"Product Safety Warning Number","Product Safety Warning Date","Product Safety Warning Title","Name of product",Description,"Hazard Description","Consumer Action","Original Product Safety Warning Announcement",Units,Incidents,"Sold At Label","Sold At",Importers,Manufacturers,Distributors,"Manufactured In","Custom Label","Custom Field"
26-383,"April 2, 2026","CPSC Warns Consumers to Stop Using Klasyt Jet Torch Lighters Immediately Due to Risk of Serious Injury or Death from Fire and Burn Hazards; Violates Mandatory Standard for Cigarette Lighters","Klasyt Jet Torch Lighters","WASHINGTON, D.C. – The U.S. Consumer Product Safety Commission (CPSC) is warning consumers to stop using Klasyt Jet Torch Lighters immediately. The lighters violate the mandatory safety standard for cigarette lighters because they do not have the required child-resistant mechanisms, posing a risk of serious injury or death from fire and burn hazards.&nbsp; &nbsp;&nbsp;Furthermore, the lighters were not reported to CPSC for review prior to distribution or importation, which is required to ensure the lighters meet all the safety requirements.&nbsp;&nbsp;&nbsp;&nbsp;&nbsp;CPSC issued a Notice of Violation to the seller, Shenzhen Jingjian Commerce &amp; Technology Co., Ltd. of China, doing business as Eryinh. Eryinh has not agreed to recall these lighters or offer a remedy to consumers.&nbsp;&nbsp;&nbsp;About 45,140 lighters were sold online at Amazon.com from March 2023 through November 2025 for about $7. The lighters may have also been sold by various third-party sellers and on other websites.&nbsp;&nbsp;The lighters resemble playing cards with a black ace card design. When ignited the lighter produces a green flame. CPSC is aware the firm may have also sold similar lighters in king, gold ace, and joker card designs.&nbsp;These products were manufactured in China.&nbsp;CPSC urges consumers to stop using the lighters immediately and dispose of them. Do not sell or give away these hazardous lighters.&nbsp;&nbsp;","The lighters violate the mandatory safety standard for https://www.cpsc.gov/Business--Manufacturing/Business-Education/Busines… lang=""EN-US"">cigarette lighters because they do not have the required child-resistant mechanisms, posing a risk of serious injury or death from fire and burn hazards.","CPSC urges consumers to stop using the lighters immediately and dispose of them. Do not sell or give away these hazardous lighters.&nbsp;&nbsp;",,"About 45,140",,"Sold Online At","Sold online at Amazon.com from March 2023 through November 2025 for about $7.",,,,China,Seller,"Shenzhen Jingjian Commerce &amp; Technology Co., Ltd. of China, doing business as Eryinh. Eryinh."
26-376,"April 2, 2026","CPSC Warns Consumers to Stop Using KVRFLTF Bed Rails Immediately Due to Risk of Serious Injury or Death from Entrapment and Asphyxiation Hazards; Violates Mandatory Standard for Adult Portable Bed Rails","KVRFLTF bed rails","WASHINGTON, D.C. – The U.S. Consumer Product Safety Commission (CPSC) is warning consumers to immediately stop using KVRFLTF bed rails because they violate the mandatory standard for adult portable bed rails, posing a deadly risk of entrapment and asphyxiation. When the bed rails are attached to a bed, users can become entrapped within the bed rail, or between the bed rail and the side of the mattress.&nbsp;&nbsp;CPSC issued a Notice of Violation to the retailer, Nanning Decan Electronic Commerce Service Co., Ltd., of China, doing business as, KVRFLTF. KVRFLTF has not agreed to recall these bed rails or offer a remedy to consumers.&nbsp;&nbsp;&nbsp;&nbsp;About 1,000 bed rails were sold online on Amazon.com from August 2023 through February 2026 for about $60. The bed rails may have also been sold on other websites.&nbsp;&nbsp;&nbsp;The KVRFLTF-branded bed rails were sold for use on adult beds. The foldable bed rails measure about 31.5 inches wide by 40 inches high and have black metal tubing, black foam handle grips, support legs and a fabric pouch. “Model: HC030” is printed on the product packaging.&nbsp;&nbsp;&nbsp;CPSC urges consumers to stop using the bed rails immediately and dispose of them. Do not sell or give away these hazardous adult portable bed rails.&nbsp;","When the bed rails are attached to a bed, users can become entrapped within the bed rail, or between the bed rail and the side of the mattress.","CPSC urges consumers to stop using the bed rails immediately and dispose of them. Do not sell or give away these hazardous adult portable bed rails.&nbsp;&nbsp;",,"About 1,000",,"Sold Online At","Sold online on Amazon.com from August 2023 through February 2026 for about $60. The bed rails may have also been sold on other websites.&nbsp;",,,,China,Retailer,"Nanning Decan Electronic Commerce Service Co., Ltd., of China, doing business as, KVRFLTF"
26-371,"April 2, 2026","CPSC Warns Consumers to Stop Using SEN-QII Pressure Washers Immediately Due to Serious Shock and Electrocution Hazards; Risk of Serious Injury or Death","SEN-QII pressure washers","WASHINGTON, D.C. – The U.S. Consumer Product Safety Commission (CPSC) is warning consumers to stop using SEN-QII pressure washers immediately. The pressure washers lack an integrated immersion protection device on or near the power plug, also known as a Ground-Fault Circuit-Interrupter (GFCI), posing a risk of death or serious injury due to electrocution and shock. These pressure washers do not comply with the applicable voluntary standard.The pressure washers were sold online at Amazon.com for between $79 and $100. These pressure washers were sold with four quick disconnect nozzles and a foam cannon, as well as four roller wheels.&nbsp; The pressure washer has an information label on the top of the unit, behind the handle that reads “High Pressure Washer.”SEN-QII of China has refused to agree to an acceptable recall to address this hazard.The pressure washers were manufactured in China.CPSC urges consumers to stop using the pressure washers immediately, and destroy them by unplugging, cutting the power cord, and disposing of them.&nbsp; Do not sell or give away these hazardous pressure washers.Report any incidents involving injury or product defect to CPSC at&nbsp;www.SaferProducts.gov.","The pressure washers lack an integrated immersion protection device on or near the power plug, also known as a Ground-Fault Circuit-Interrupter (GFCI), posing a risk of death or serious injury due to electrocution and shock. These pressure washers do not comply with the applicable voluntary standard.","CPSC urges consumers to stop using the pressure washers immediately, and destroy them by unplugging, cutting the power cord, and disposing of them.&nbsp; Do not sell or give away these hazardous pressure washers.",,,,"Sold Online At","Amazon.com for between $79 and $100.",,,,China,,
26-370,"April 2, 2026","CPSC Warns Consumers to Stop Using Vlaseo Pressure Washers Immediately Due to Serious Shock and Electrocution Hazards; Risk of Serious Injury or Death","Vlaseo pressure washers","WASHINGTON, D.C. – The U.S. Consumer Product Safety Commission (CPSC) is warning consumers to stop using Vlaseo pressure washers immediately . The pressure washers lack an integrated immersion protection device on or near the power plug, also known as a Ground-Fault Circuit-Interrupter (GFCI), posing a risk of death or serious injury due to electrocution and shock. These pressure washers do not comply with the applicable voluntary standard.The pressure washers were sold online at Amazon.com for between $99 and $300. These pressure washers are green and black in color and come with four quick connect nozzles and a foam cannon.Vlaseo Store of China has not responded to requests for a recall.The pressure washers were manufactured in China.CPSC urges consumers to stop using the pressure washers immediately, and destroy them by unplugging, cutting the power cord, and disposing of them.&nbsp; Do not sell or give away these hazardous pressure washers.Report any incidents involving injury or product defect to CPSC at&nbsp;www.SaferProducts.gov.","The pressure washers lack an integrated immersion protection device on or near the power plug, also known as a Ground-Fault Circuit-Interrupter (GFCI), posing a risk of death or serious injury due to electrocution and shock. These pressure washers do not comply with the applicable voluntary standard.","CPSC urges consumers to stop using the pressure washers immediately, and destroy them by unplugging, cutting the power cord, and disposing of them.&nbsp; Do not sell or give away these hazardous pressure washers.",,,,"Sold At","The pressure washers were sold online at Amazon.com for between $99 and $300.&nbsp;",,,,China,,
26-367,"April 2, 2026","CPSC Warns Consumers to Stop Using “Relaxing Baby” Swim Floats Immediately Due to Risk of Serious Injury or Death from Drowning; One Child Death Reported","“Relaxing Baby” Swim Floats","WASHINGTON, D.C. – The U.S. Consumer Product Safety Commission (CPSC) is warning consumers to stop using “Relaxing Baby” Swim Floats immediately because they can flip over and/or submerge the occupant underwater, posing a risk of drowning to infants and toddlers.CPSC is aware of a drowning death of a two-year-old child who was using the hazardous floats.Wu He/Relaxing Baby, of China, the seller, has been unresponsive to CPSC requests for a recall.The hazardous products are blue and green inflatable swimming floats intended for use by young children ages 3-36 months. The child is placed in a seat in the center of the float and secured with a buckle. Certain models of the product also include a detachable rear float.The&nbsp;hazardous&nbsp;swim floats were sold on Amazon.com and are listed on other websites, like ebay.com.CPSC urges consumers to puncture the plastic in any location where the product can inflate and dispose of the swim float immediately. Do not sell or give away these hazardous swim floats.Report any incidents involving injury or product defect to CPSC at&nbsp;www.SaferProducts.gov.&nbsp;","The “Relaxing Baby” Swim Floats can flip over and/or submerge the occupant underwater, posing a risk of drowning to infants and toddlers.&nbsp;","CPSC urges consumers to puncture the plastic in any location where the product can inflate and dispose of the swim float immediately. Do not sell or give away these hazardous swim floats.",,,"CPSC is aware of a drowning death of a two-year-old child who was using the hazardous floats.","Sold At","Amazon.com and are listed on other websites, like ebay.com.",,,,China,Seller:,"Wu He/Relaxing Baby"
26-366,"April 2, 2026","CPSC Warns Consumers to Stop Using Apromise Portable Outdoor Grill Tables Immediately Due to Risk of Fingertip Amputation and Crushing Injuries; Multiple Fingertip Amputations Reported","Apromise Portable Outdoor Grill Tables","WASHINGTON, D.C. – The U.S. Consumer Product Safety Commission (CPSC) is warning consumers to stop using Apromise Portable Outdoor Grill Tables, Model GCNJ2401B, immediately due to the risk of fingertip amputation and crushing injuries when the products fold or collapse.&nbsp;CPSC is aware of at least 15 incidents associated with the use of these products. There are reports of incidents where consumers’ fingers have been caught in pinch point areas, including the sliding track for the legs of the product, when the product folds or collapses, resulting in at least seven fingertip amputations, a fractured finger and a laceration requiring sutures.The grill tables are made of steel and have an opening in which various tabletop grills can be placed. The tables have wheels on one side of the base, a side shelf, a paper towel holder and hooks for grilling accessories.&nbsp;The products were sold by Apro Direct, of China, online on Amazon.com and on eBay. Apro Direct has not agreed to recall the products.&nbsp;The products were manufactured in China.&nbsp;CPSC urges consumers to stop using the grill tables immediately and dispose of them. Do not sell or give away these hazardous products.Report any incidents involving injury or product defect to CPSC at&nbsp;www.SaferProducts.gov.","CPSC is warning consumers to stop using Apromise Portable Outdoor Grill Tables, Model GCNJ2401B, immediately due to the risk of fingertip amputation and crushing injuries when the products fold or collapse.&nbsp;","CPSC urges consumers to stop using the grill tables immediately and dispose of them. Do not sell or give away these hazardous products.",,,"CPSC is aware of at least 15 incidents associated with the use of these products. There are reports of incidents where consumers’ fingers have been caught in pinch point areas, including the sliding track for the legs of the product, when the product folds or collapses, resulting in at least seven fingertip amputations, a fractured finger and a laceration requiring sutures.","Sold Online At","&nbsp;Amazon.com and on eBay",,,,China,,
26-364,"April 2, 2026","CPSC Warns Consumers to Stop Using Rozato Tabletop Fire Pits Immediately Due to Flame Jetting and Fire Hazards; One Death and Serious Burn Injuries Reported","Rozato Tabletop Fire Pits","WASHINGTON, D.C. – The U.S. Consumer Product Safety Commission (CPSC) is warning consumers to stop using Rozato Tabletop Fire Pits immediately because using them can result in uncontrolled pool fires where flames burn across the surface of pooled or spilled alcohol, as well as flame jetting from fuel containers, resulting in serious or fatal burns.&nbsp;These fire pits have been associated with one death and multiple burn injuries.&nbsp; This CPSC consumer alert follows the agency’s recent&nbsp;warning to stop using alcohol or other liquid-burning fire pits that violate voluntary standards and present flame jetting and fire hazards.&nbsp; &nbsp;The Rozato Tabletop Fire Pits are rectangular or round containers that require consumers to pour liquid fuel into the container and then ignite the pooled liquid in the same location it was poured.&nbsp; Isopropyl (rubbing) alcohol, ethanol/bioethanol, and similar liquid fuels can burn with flame temperatures over 1,600°F and can cause third degree burns in less than one second. &nbsp;Igniting a pool of alcohol or other liquid fuel in the fire pit’s open container can result in an uncontrolled pool fire, which can suddenly produce larger, hotter flames that can spread beyond the fire pit product.&nbsp;Flame jetting, another hazard, can occur when refilling the fire pit if any flame is present. &nbsp;A small flame in the fire pit can be hard to see and can ignite the vapor inside a fuel container as the fuel is poured, causing an explosion that propels flames and burning liquid onto the consumer or bystanders. &nbsp;CPSC’s&nbsp;flame jetting safety video demonstrates the potential force of flame jetting and the long distances flames and burning liquid can travel.Rozato, the retailer of Rozato Tabletop Fire Pits, has not agreed to a recall.&nbsp;The rectangular fire pits were sold in a set that includes a bamboo serving board, three extendable roasting forks, four cheese forks, and a cheese knife.&nbsp; The round fire pits were sold in a set that includes four extendable roasting forks.Rozato Tabletop Fire Pits were sold online, at Rozato.Store, Amazon.com, StoreDune.com, StovesDirect.com, RetailMarket.net and other websites from 2022 to present for about $15 to $70.&nbsp;The Rozato Tabletop Fire Pits are manufactured in China.CPSC urges consumers to stop using the fire pits immediately and dispose of them. Do not sell or give away these hazardous products.Report any incidents involving injury or product defect to CPSC at&nbsp;www.SaferProducts.gov.","Using the Rozato Tabletop Fire Pits can result in uncontrolled pool fires where flames burn across the surface of pooled or spilled alcohol, as well as flame jetting from fuel containers, resulting in serious or fatal burns.&nbsp;&nbsp;","CPSC urges consumers to stop using the fire pits immediately and dispose of them. Do not sell or give away these hazardous products.",,,,"Sold Online At","Rozato.Store, Amazon.com, StoreDune.com, StovesDirect.com, RetailMarket.net and other websites from 2022 to present for about $15 to $70.&nbsp;",,,,China,Retailer:,Rozato
26-362,"March 31, 2026","CPSC Warns Consumers to Stop Using Ganjiang New District Yuslow Toys Sales Male-to-Male Extension Cords Immediately Due to Risk of Serious Injury and Death from Electrocution and Carbon Monoxide Poisoning Hazards","Ganjiang New District Yuslow Toys Sales male-to-male extension cords","WASHINGTON, D.C. –&nbsp;The U.S. Consumer Product Safety Commission (CPSC) is warning consumers to stop using Ganjiang New District Yuslow Toys Sales male-to-male extension cords immediately due to electrocution, fire and carbon monoxide poisoning hazards. The male-to-male extension cords are hazardous because their exposed prongs can become energized when one end is plugged into a generator or other power source, posing a risk of serious injury and death from electrocution. In addition, using the cables to supply power from a generator to a residential electrical system (“backfeeding”) poses a risk of electrocution and fire. Furthermore, the cables’ short length encourages the use of generators close to homes or enclosed spaces, posing a risk of carbon monoxide poisoning.Ganjiang New District Yuslow Toys Sales Co. Ltd., of China, imported this product and has been unresponsive to CPSC requests for a recall or information about this product.About 150 extension cords were sold on AliExpress.com by GOOD LIFE TO U store from October 2025 through November 2025 for about $15. The red extension cords have two male ends with a three-prong black plug and measure about 24 inches long. The importer or the seller’s name can be found on the product’s purchase receipt.&nbsp;These products were manufactured in China.CPSC urges consumers to stop using these defective male-to-male extension cords immediately, safely unplugging them by not touching the live end of the cord and dispose of them.","The male-to-male extension cords are hazardous because their exposed prongs can become energized when one end is plugged into a generator or other power source, posing a risk of serious injury and death from electrocution. In addition, using the cables to supply power from a generator to a residential electrical system (“backfeeding”) poses a risk of electrocution and fire. Furthermore, the cables’ short length encourages the use of generators close to homes or enclosed spaces, posing a risk of carbon monoxide poisoning.","CPSC urges consumers to stop using these defective male-to-male extension cords immediately, safely unplugging them by not touching the live end of the cord and dispose of them.",,"About 150",,"Sold At","The extension cords were sold on AliExpress.com by GOOD LIFE TO U store from October 2025 through November 2025 for about $15.",,,,China,,
26-361,"March 31, 2026","CPSC Warns Consumers to Stop Using Hefei Yaduan Trading Male-to-Male Extension Cords Immediately Due to Risk of Serious Injury and Death from Electrocution and Carbon Monoxide Poisoning Hazards","Hefei Yaduan Trading male-to-male extension cords","WASHINGTON, D.C. –&nbsp;The U.S. Consumer Product Safety Commission (CPSC) is warning consumers to stop using Hefei Yaduan Trading male-to-male extension cords immediately due to electrocution, fire and carbon monoxide poisoning hazards. The male-to-male extension cords are hazardous because their exposed prongs can become energized when one end is plugged into a generator or other power source, posing a risk of serious injury and death from electrocution. In addition, using the cables to supply power from a generator to a residential electrical system (“backfeeding”) poses a risk of electrocution and fire. In addition, the cables’ short length encourages the use of generators close to homes or enclosed spaces, posing a risk of carbon monoxide poisoning.Hefei Yaduan Trading Co., Ltd. of China, sold this product and has been unresponsive to CPSC requests for a recall or information about this product.About five extension cords were sold on eBay.com by 4ubenefit from October 2025 through November 2025 for about $12. The yellow extension cords have two male ends with a three-prong black plug and measure about 22 inches long. The seller’s name can be found on the product’s purchase receipt.&nbsp;These products were manufactured in China.CPSC urges consumers to stop using these defective male-to-male extension cords immediately, safely unplugging them by not touching the live end of the cord and dispose of them.","The male-to-male extension cords are hazardous because their exposed prongs can become energized when one end is plugged into a generator or other power source, posing a risk of serious injury and death from electrocution. In addition, using the cables to supply power from a generator to a residential electrical system (“backfeeding”) poses a risk of electrocution and fire. In addition, the cables’ short length encourages the use of generators close to homes or enclosed spaces, posing a risk of carbon monoxide poisoning.","CPSC urges consumers to stop using these defective male-to-male extension cords immediately, safely unplugging them by not touching the live end of the cord and dispose of them.",,"About five",,"Sold At","The extension cords were sold on eBay.com by 4ubenefit from October 2025 through November 2025 for about $12.",,,,China,,
26-360,"March 31, 2026","CPSC Warns Consumers to Stop Using Huizhou Xiyan Digital Male-to-Male Extension Cords Immediately Due to Risk of Serious Injury and Death from Electrocution and Carbon Monoxide Poisoning Hazards","Huizhou Xiyan Digital male-to-male extension cords","WASHINGTON, D.C. –&nbsp;The U.S. Consumer Product Safety Commission (CPSC) is warning consumers to stop using Huizhou Xiyan Digital male-to-male extension cords immediately due to electrocution, fire and carbon monoxide poisoning hazards. The male-to-male extension cords are hazardous because their exposed prongs can become energized when one end is plugged into a generator or other power source, posing a risk of serious injury and death from electrocution. In addition, using the cables to supply power from a generator to a residential electrical system (“backfeeding”) poses a risk of electrocution and fire. Furthermore, the cables’ short length encourages the use of generators close to homes or enclosed spaces, posing a risk of carbon monoxide poisoning.Huizhou Xiyan Digital Co. Ltd., of China, imported this product and has been unresponsive to CPSC requests for a recall or information about this product.About 600 extension cords were sold on AliExpress.com by ABSF Tools store from May 2025 through November 2025 for about $30. The yellow extension cords have two male ends with a three-prong black plug and measure about 25 inches long. The importer or the seller’s name can be found on the product’s purchase receipt.&nbsp;These products were manufactured in China.CPSC urges consumers to stop using these defective male-to-male extension cords immediately, safely unplugging them by not touching the live end of the cord and dispose of them.","The male-to-male extension cords are hazardous because their exposed prongs can become energized when one end is plugged into a generator or other power source, posing a risk of serious injury and death from electrocution. In addition, using the cables to supply power from a generator to a residential electrical system (“backfeeding”) poses a risk of electrocution and fire. Furthermore, the cables’ short length encourages the use of generators close to homes or enclosed spaces, posing a risk of carbon monoxide poisoning.","CPSC urges consumers to stop using these defective male-to-male extension cords immediately, safely unplugging them by not touching the live end of the cord and dispose of them.",,"About 600",,"Sold At","The extension cords were sold on AliExpress.com by ABSF Tools store from May 2025 through November 2025 for about $30.",,,,China,,
